{
  "actor_organization_id": "caa-fixture",
  "aggregate_id": "finding-ref-001",
  "aggregate_revision": 1,
  "aggregate_type": "cap",
  "business_key": "finding-ref-001",
  "causation_id": "10000000-0000-4000-8000-000000000005",
  "contract_id": "aviasurveil.production-feed.events",
  "contract_version": "3.0.0",
  "correlation_id": "20000000-0000-4000-8000-000000000001",
  "effective_at": "2026-08-06T08:00:00Z",
  "emitted_at": "2026-08-06T08:00:01Z",
  "entity_refs": {
    "audit_id": "audit-ref-001",
    "cap_id": "cap-ref-001",
    "finding_id": "finding-ref-001"
  },
  "event_id": "10000000-0000-4000-8000-000000000006",
  "event_type": "cap.submitted",
  "event_version": 1,
  "known_at": "2026-08-06T08:00:01Z",
  "occurred_at": "2026-08-06T08:00:00Z",
  "owning_organization_id": "organization-fixture",
  "payload": {
    "action_code": "corrective_action",
    "target_completion_at": "2026-08-20T12:00:00Z"
  },
  "payload_sha256": "4e7305cdde62e24d23ea947f61c088e2b84d1d84baf95832d9ffdeefa375b509",
  "privacy_class": "P2",
  "schema_version": "3.0.0",
  "source_module": "aviasurveil360",
  "source_system": "aviasurveil-production-api",
  "state_after": "cap_under_review",
  "state_before": "finding_open",
  "tenant_id": "tenant-contract-fixture",
  "visibility_purpose_code": "regulated_oversight"
}
