{
  "actor_organization_id": "caa-fixture",
  "aggregate_id": "generation_run_id-fixture",
  "aggregate_revision": 1,
  "aggregate_type": "checklist_generation",
  "business_key": "checklist_generation-impact_review_recorded-fixture",
  "causation_id": null,
  "contract_id": "aviasurveil.production-feed.events",
  "contract_version": "3.0.0",
  "correlation_id": "10000000-0000-4000-8000-000000000002",
  "effective_at": "2026-07-29T00:00:00Z",
  "emitted_at": "2026-07-29T00:00:00Z",
  "entity_refs": {
    "candidate_id": "candidate_id-fixture",
    "generation_run_id": "generation_run_id-fixture",
    "impact_review_id": "impact_review_id-fixture"
  },
  "event_id": "10000000-0000-4000-8000-000000000001",
  "event_type": "checklist_generation.impact_review_recorded",
  "event_version": 1,
  "known_at": "2026-07-29T00:00:00Z",
  "occurred_at": "2026-07-29T00:00:00Z",
  "owning_organization_id": "organization-fixture",
  "payload": {
    "adaptive_scope_guardrail_code": "fixture-code",
    "candidate_id": "fixture-code",
    "decided_at": "2026-07-29T00:00:00Z",
    "disjoint_holdout_partition_id": "fixture-code",
    "generation_run_id": "fixture-code",
    "holdout_evaluated_count": 1,
    "holdout_population_count": 1,
    "impact_decision_code": "fixture-code",
    "impact_review_id": "fixture-code",
    "overlap_count": 1
  },
  "payload_sha256": "e79c4936dc24c1e49a523fd9db53b05323a4004787a14f2d42535267c35c96c6",
  "privacy_class": "P2",
  "schema_version": "3.0.0",
  "source_module": "aviasurveil360",
  "source_system": "aviasurveil360",
  "state_after": "generation_impact_reviewed",
  "state_before": null,
  "tenant_id": "tenant-fixture",
  "visibility_purpose_code": "regulated_oversight"
}
