{
  "actor_organization_id": "caa-fixture",
  "aggregate_id": "finding-ref-001",
  "aggregate_revision": 1,
  "aggregate_type": "information_request",
  "business_key": "finding-ref-001",
  "causation_id": "10000000-0000-4000-8000-000000000010",
  "contract_id": "aviasurveil.production-feed.events",
  "contract_version": "3.0.0",
  "correlation_id": "20000000-0000-4000-8000-000000000001",
  "effective_at": "2026-08-11T08:00:00Z",
  "emitted_at": "2026-08-11T08:00:01Z",
  "entity_refs": {
    "audit_id": "audit-ref-001",
    "finding_id": "finding-ref-001",
    "request_id": "request-ref-001"
  },
  "event_id": "10000000-0000-4000-8000-000000000011",
  "event_type": "information_request.responded",
  "event_version": 1,
  "known_at": "2026-08-11T08:00:01Z",
  "occurred_at": "2026-08-11T08:00:00Z",
  "owning_organization_id": "organization-fixture",
  "payload": {
    "responded_at": "2026-08-05T12:00:00Z",
    "response_reference": "response-ref-001"
  },
  "payload_sha256": "8ef0278ed87dd2461b81b8eae20c350322d3623a2a98e92074f5b4aa4f83a8a8",
  "privacy_class": "P2",
  "schema_version": "3.0.0",
  "source_module": "aviasurveil360",
  "source_system": "aviasurveil-production-api",
  "state_after": "finding_open",
  "state_before": "information_requested",
  "tenant_id": "tenant-contract-fixture",
  "visibility_purpose_code": "regulated_oversight"
}
