{
  "actor_organization_id": "caa-fixture",
  "aggregate_id": "generation_run_id-fixture",
  "aggregate_revision": 1,
  "aggregate_type": "checklist_generation",
  "business_key": "checklist_generation-candidate_versioned-fixture",
  "causation_id": null,
  "contract_id": "aviasurveil.production-feed.events",
  "contract_version": "3.0.0",
  "correlation_id": "10000000-0000-4000-8000-000000000002",
  "effective_at": "2026-07-29T00:00:00Z",
  "emitted_at": "2026-07-29T00:00:00Z",
  "entity_refs": {
    "candidate_id": "candidate_id-fixture",
    "generation_run_id": "generation_run_id-fixture"
  },
  "event_id": "10000000-0000-4000-8000-000000000001",
  "event_type": "checklist_generation.candidate_versioned",
  "event_version": 1,
  "known_at": "2026-07-29T00:00:00Z",
  "occurred_at": "2026-07-29T00:00:00Z",
  "owning_organization_id": "organization-fixture",
  "payload": {
    "candidate_digest": "aaaaaaaaaaaaaaaaaaaaaaaaaaaaaaaaaaaaaaaaaaaaaaaaaaaaaaaaaaaaaaaa",
    "candidate_id": "fixture-code",
    "candidate_revision": 1,
    "generation_run_id": "fixture-code",
    "ordered_question_snapshot": [
      {
        "allowed_answer_codes": [
          "yes",
          "no",
          "na"
        ],
        "citation_reference_ids": [
          "citation-fixture-1"
        ],
        "expected_evidence_type_codes": [
          "controlled_document"
        ],
        "mandatory": true,
        "mapping_reference_ids": [
          "mapping-fixture-1"
        ],
        "ordinal": 1,
        "prompt": "Verify the controlled requirement.",
        "question_id": "question-fixture-1",
        "safety_critical": false,
        "verification_method_code": "document_review"
      }
    ],
    "parent_configuration_digest": "aaaaaaaaaaaaaaaaaaaaaaaaaaaaaaaaaaaaaaaaaaaaaaaaaaaaaaaaaaaaaaaa",
    "provider_scope_ref": "fixture-code",
    "qualifier_codes": [
      "fixture-code"
    ],
    "question_count": 1,
    "typed_target_ref": "fixture-code"
  },
  "payload_sha256": "cb2bba902f9c86616ad71a9a3bcb6988ea2c1117b70c0b5905f3b6aa95b1d954",
  "privacy_class": "P2",
  "schema_version": "3.0.0",
  "source_module": "aviasurveil360",
  "source_system": "aviasurveil360",
  "state_after": "generation_candidate_versioned",
  "state_before": null,
  "tenant_id": "tenant-fixture",
  "visibility_purpose_code": "regulated_oversight"
}
